question,answer,category,tags,priority
How do I configure CLOUDWATCH MULE INTEGRATION - System Architecture?,"CLOUDWATCH MULE INTEGRATION - System Architecture Note: NOVA was formerly known as IO Connect Services. URLs in this document still reference the ioconnectservices.com domain for technical compatibility. The CloudWatch Mule Integration is an agent-based integration. Pre-requisites NOVA API The CloudWatch Mule Integration does a license check via SSL and hence it requires outbound access to: - https://api.ioconnectservices.com/ - *Port: 443* On-prem Mule servers On-prem Mule servers must be registered in Anypoint Runtime Manager (ARM) to be able to collect data. The RM Agent comes in the /bin folder of the Mule runtime, then you can perform the command in CLI. See instructions in https://docs.mulesoft.com/runtime-manager/servers- create. Any server that’s registered in a group or cluster in ARM must be able to gather metrics from those as well. Mule Networking pre-requisites In order for the agent to properly connect to ARM in Anypoint, specific network configuration must be allowed. All DNS names, ports and IPs needed to hook the agent are documented in https://docs.mulesoft.com/runtime- manager/rtm-agent-whitelists. CloudHub applications Given the cloud nature of applications deployed to CloudHub, all application and server metadata is intrinsically stored by default on Anypoint Control Plane. No special configuration is required other than the needed permissions in the connected app. Ports and Hostnames to whitelist The CloudWatch Mule Integration must have an internet connection on port 443 for outbound connections at least. In enterprises, it’s very common that all networks are behind a firewall to protect access. In many other cases, reverse proxies are used to protect outbound communications to restricted websites. Customers must configure rules in the firewall and proxies to ensure the communication to all NOVA Services, Anypoint and CloudWatch. NOVA networking requirements This is an outbound communication only and it’s initiated by the CloudWatch agent running on-premise. MuleSoft Anypoint networking requirements Communication from Mule servers, installed on-prem, must allow inbound and outbound connections to the following DNS names via port 443 (HTTPS) and 9999 (configurable websocket). Here is a full list of the FQDNs that need to be whitelisted. Pick the ones corresponding to the region to which you MuleSoft organization belongs to. - anypoint.mulesoft.com - eu1.anypoint.mulesoft.com - mule-manager.anypoint.mulesoft.com - mule-manager.eu1.anypoint.mulesoft.com - runtime-manager.anypoint.mulesoft.com - runtime-manager.eu1.anypoint.mulesoft.com - arm-auth-proxy.prod.cloudhub.io - arm-auth-proxy.prod-eu.msap.io - data-authenticator.anypoint.mulesoft.com - data-authenticator.eu1.anypoint.mulesoft.com - analytics-ingest.anypoint.mulesoft.com - analytics-ingest.eu1.anypoint.mulesoft.com - exchange2-asset-manager-kprod.s3.amazonaws.com - exchange2-asset-manager-kprod-eu.s3.eu-central-1.amazonaws.com Learn more about the MuleSoft Anypoint networking requisites in https://docs.mulesoft.com/runtime-manager/rtm-agent-whitelists CloudWatch networking requirements Communication from the CloudWatch agent is via port 443 (HTTPS). < OOTB Operations",datadog-mulesoft-docs,"datadog,mulesoft,documentation,configuration,cloudwatch,architecture",high
What is Datadog Mule Integration and how does it work?,Datadog Mule Integration Overview Datadog Mule Integration is an agent-based integration that collects metrics from MuleSoft products and uploads them onto Datadog. In the Datadog Mule Integration bundle you will find: 150+ metrics 7 out-of-the-box dashboards 13 out-of-the-box monitors Datadog Connector for Mule 4 You can use these metrics to take advantage of the out-of-the-box dashboards and monitors or you can create your own visualizations.,datadog-mulesoft-docs,"datadog,mulesoft,documentation,overview,connector,dashboard",high
What is Datadog Mule Integration 4 APM and how does it work?,"Datadog Mule Integration 4 APM Datadog Integration Datadog Mule Integration 4 APM • Installation Process • APM Connector Configurations • APM Connector Operations • Step by step tracing Sample Introduction to Datadog Mule Integration 4 APM (DMI4APM) Overview The Datadog Mule Integration 4 APM (DMI4APM) enhances the monitoring capabilities of your Mule applications by seamlessly integrating with Datadog's APM system. Our solution extends the functionality of Datadog's APM connector by adding Mule-specific operations that encapsulate application flows. These operations not only capture and send trace data to Datadog APM but also facilitate the propagation of these traces across Mule applications and APIs. Datadog APM Integration Datadog's Application Performance Monitoring (APM) offers real-time insights into the performance of your applications, helping you track requests as they travel across different services and detect issues before they affect your customers. DMI4APM leverages this powerful feature to provide in-depth visibility into the health and performance of Mule applications. Logs DMI4APM ensures that all operational data is captured and logged, allowing for comprehensive traceability. The connector processes these traces, ensuring that the full journey of a request is visible in the Datadog APM interface, from the entry point in a Mule application to external services and back. Mule Application Requirements - APM Mule Connector : Your Mule applications or APIs must have the APM Mule connector installed. This connector is vital for wrapping your application flows and enabling the propagation of trace data to the Datadog APM system. You can find it here. - Application Modifications : You will need to integrate Mule connector operations into your Mule applications or APIs. This step is essential for capturing the performance data that DMI4APM will process and send to Datadog. Software Requirements - Java : Java 21 must be installed on your system, as DMI4APM requires it to run the necessary processes for APM data collection and integration. - Datadog Agent : A functioning Datadog Agent installation is required to facilitate the collection and forwarding of metrics and traces to the Datadog platform. System and Network Requirements - Operating System : DMI4APM is compatible with both Linux and Windows operating systems, allowing you to choose the environment that best fits your infrastructure. - TCP Port : Ensure that TCP port 8127 is available and not being used by any other processes. DMI4APM uses this port to receive APM trace data, so it is crucial that this port is free to avoid any conflicts. Important Notes - Verify that your system meets these requirements before proceeding with the installation. - Additional dependencies or configurations may be required depending on your specific system setup or the complexity of your Mule applications. By meeting the above requirements, you can ensure that DMI4APM will function correctly within your Mule environment, providing you with comprehensive monitoring and improved performance insights. System architecture Installation Guide for DMI4APM from the Datadog Marketplace Before beginning the installation process for the Datadog Mule Integration 4 APM (DMI4APM), ensure that you have a Datadog account and that the Datadog Agent is installed and running on your system. The installation process outlined below is necessary to enable DMI4APM within your infrastructure, allowing you to start monitoring your Mule applications with Datadog's advanced APM capabilities. Prerequisites Datadog Account: Ensure you have an active Datadog account. If you do not have an account, you can sign up at the Datadog website. Datadog Agent: The Datadog Agent must be installed and functioning on your system. For installation instructions, refer to the official Datadog Agent documentation. System Compatibility: Verify that your system meets all the necessary requirements as described in the previous sections, including software, system, and network requirements. Connected App: DMI4APM requires an Anypoint Platform connected app to validate there is an active Mule license. At the level of the Anypoint Platform master organization, create a connected app as ""App acts on its own behalf - client credentials"" and assign the ""View Organization"" permission. Installation Steps Once you have met all the prerequisites, follow these steps to install DMI4APM from the Datadog Marketplace: Note: This steps must be executed as a standard user. Use root privileges only with specific sudo commands. Open a Terminal or Command Prompt: Access your terminal or command prompt on the system where the Datadog Agent is installed. Run the Installation Command: Enter and execute the following command to install the DMI4APM integration: sudo -u dd-agent datadog-agent integration install --third-party datadog-iocs- dmi4apm==X.Y.Z This command installs the DMI4APM version X.Y.Z as a third-party integration within your Datadog Agent environment. Next Steps After successfully installing DMI4APM, proceed with the configuration guide to set up and customize DMI4APM according to your monitoring needs. This includes setting up initial configuration settings, instances, and key configuration elements as detailed in the previous sections. By following these steps and ensuring your system meets all requirements, you can leverage DMI4APM for comprehensive monitoring and improved performance insights within your Mule environment. Configuration Guide for Datadog Mule Integration 4 APM (DMI4APM) DMI4APM requires specific configuration settings to ensure successful integration with the Datadog platform and the Mule applications. Below is a guide to help you configure DMI4APM with the initial settings necessary for the Datadog integration. Configuration Settings Begin by setting the initial configuration for your integration with Datadog. This involves specifying the client_id and client_secret provided by Mule, as well as the dd_api_key , which is your unique Datadog API key. These configuration settings will be provided in the conf.yaml file, which can be found in at /etc/datadog-agent/conf.d/iocs_dmi4apm.d/ Initial configuration settings for the Datadog integration init_config: client_id: """" client_secret: """" dd_api_key: """" Replace < YOUR_MULE_CLIENT_ID>, < YOUR_MULE_CLIENT_SECRET>, and < YOUR_DATADOG_API_KEY> with the credentials provided to you by Mule and Datadog. Next, configure the instances and set the parameters for collection intervals, buffer sizes, tracer ports, and server ports. Here is an example configuration: instances: - min_collection_interval: 15 tracer: source: port: 8127 destination: port: 8126 vm_options: - ""-Xmx128m"" Key Configuration Elements - min_collection_interval : The minimum interval between data collections, in seconds. - tracer : - source.port : The port where DMI4APM listens for incoming trace data (8127 by default",datadog-mulesoft-docs,"datadog,mulesoft,documentation,overview,apm,connector",high
"How do I configure < YOUR_MULE_CLIENT_ID>, < YOUR_MULE_CLIENT_SECRET>, and <?","< YOUR_MULE_CLIENT_ID>, < YOUR_MULE_CLIENT_SECRET>, and < YOUR_DATADOG_API_KEY> with the credentials provided to you by Mule and Datadog. Next, configure the instances and set the parameters for collection intervals, buffer sizes, tracer ports, and server ports. Here is an example configuration: instances: - min_collection_interval: 15 tracer: source: port: 8127 destination: port: 8126 vm_options: - ""-Xmx128m"" Key Configuration Elements - min_collection_interval : The minimum interval between data collections, in seconds. - tracer : - source.port : The port where DMI4APM listens for incoming trace data (8127 by default). - destination.port : The port to which DMI4APM forwards the trace data (8126 by default). - vm_options : JVM options for running DMI4APM, such as memory limits. Applying the Configuration To apply these settings, insert them into the appropriate configuration file for DMI4APM, typically named conf.yaml or similar this has to be save in the following folder. Linux: /etc/datadog-agent/conf.d/iocs_dmi4apm.d Windows: C:\ProgramData\Datadog\conf.d\iocs_dmi4apm.d After updating the configuration file with your specific values, restart DMI4APM to apply the changes. - Always keep your client_id , client_secret , and dd_api_key secure and do not share them publicly. - Adjust the buffer size and time limit settings based on the volume of your trace data and network conditions. - The VM options should be set according to the available system resources and the needs of your application. By following this guide and correctly applying the configuration settings, you will establish a robust connection between your Mule applications and Datadog's monitoring services. Verification: After the installation completes, verify that DMI4APM has been installed successfully by checking the Datadog Agent's status. You can do this by running: sudo -u dd-agent datadog-agent status Look for datadog-iocs-dmi4apm in the list of installed integrations to confirm that the installation was successful. To confirm if the DMI4APM integration is running, follow these steps: Navigate to the log directory by using the following path: /var/log/datadog Display the content of the apm.log file. Check the log output for the following message to verify that the integration is running:",datadog-mulesoft-docs,"datadog,mulesoft,documentation,configuration,apm,monitoring",high
How do I configure Datadog Mule Integration 4 APM?,"Datadog Mule Integration 4 APM Global Elements Datadog Mule Integration 4 APM • Installation Process • APM Connector Configurations • APM Connector Operations • Step by step tracing Sample Datadog APM Config The Datadog APM Config is the global configuration of the Connector. It establishes the connection between the Mule application and the Datadog agent running APM. These are the connection settings, here you set the host where the Datadog Agent is running, and the port. These are optional information to give more context about the connection, by default the service name is unnamed-java-app , even if this field is empty. Version: This allows you to specify the version of your app, which will be visible in the Datadog platform.",datadog-mulesoft-docs,"datadog,mulesoft,documentation,configuration,apm,connector",high
How do I configure Datadog Mule Integration 4 APM?,"Datadog Mule Integration 4 APM Log4j Datadog Mule Integration 4 APM • Installation Process • APM Connector Configurations • APM Connector Operations • Step by step tracing Sample To use this operation, you need to configure the appended in the log4j2.xml file in your project as the below example. This will help to forward the logs captured in Log4J2 to the Datadog Log platform. Note that there's a system variable, ddApiKey , that is passed at runtime. Tag Version: When you set the version property in your application, a version tag is added to all your traces. This helps correlate apps and identify errors. The global configuration now includes a ""version "" property. This allows you to specify the version of your app, which will be visible in the Datadog platform. ```yaml ``` In Studio, you can configure this variable as a VM argument. Logs forwarding in CloudHub Configure the log4j2.xml file with the CloudHub appender. ```yaml <PatternLayout pattern=""[%d{MM-dd HH:mm:ss}] %-5p %c{1} [%t]: %m%n""/> ``` When an application is deployed in CloudHub the Runtime Manager always overwrites the log4j2.xml Disable the CloudHub logs in order for Runtime Manager to apply the project’s log4j2.xml configuration file. By default, Disable CloudHub logs is not a visible option in Runtime Manager. A special request to the Mulesoft support team is required to enable this option. More info: https://docs.mulesoft.com/runtime-manager/custom-log- appender In order to deploy the app in CloudHub, add the ddkeyApi property. Because of security reasons, put in the mule-artifact.json ddApiKey as a secure property: ```yaml { ""minMuleVersion"": ""4.3.0"", ""secureProperties"": [""ddApiKey""] } ``` The logs shown in the live console are the logs generated by the log4j2.xml file. The same event Id can be seen in the log forwarded to Datadog Log.",datadog-mulesoft-docs,"datadog,mulesoft,documentation,configuration,apm,connector",high
How do I configure Datadog Mule Integration 4 APM?,Datadog Mule Integration 4 APM Run Configurations Datadog Mule Integration 4 APM • Installation Process • APM Connector Configurations • APM Connector Operations • Step by step tracing Sample,datadog-mulesoft-docs,"datadog,mulesoft,documentation,configuration,apm,connector",high
How do I configure Datadog Mule Integration 4 APM?,"Datadog Mule Integration 4 APM Note: NOVA was formerly known as IO Connect Services. URLs in this document still reference the ioconnectservices.com domain for technical compatibility. Operations Datadog Mule Integration 4 APM • Installation Process • APM Connector Configurations • APM Connector Operations • Step by step tracing Sample Create Span The create span operation as states, creates a new span in the flow, it will run in the flow until it gets finished. A span can contain Children, and those Children as well can contain Children and so on, this is useful to add granularity to the project. The operation looks like this: - Display name: By default is displayed as Create Span. - Connector configuration: This is where the Datadog Global Configuration is set, required. - Span name: required. - Parent: The parent of the created span, optional. - Finish this span at the end of the main flow: This checkbox ensures that the span will be closed automatically at the end of the flow execution, the default is unchecked. - Tags: These* are key-value pairs that can be set *Inline or with DataWeave expressions , this provides labels attached to the spans that are created in execution time, optional. - HTTP Request Tags: Additional info the user can provide to the span, in this case the HTTP Method and the URI Path in case the user may require it for REST Services. Accept DataWeave expressions as well as static values. optional. The following is an example of how to assign a child span to a parent. This flow will be used as the main example thoughout the different operation explanations. Let’s check how this can be useful. There are 3 spans created in the flow: Parent, Child, and GrandChild The main span is called Parent , then in the Child span we assign the Parent field as Parent , which is the name of the first span created, and finally, we assign GrandChild span Parent field as Child. With this we have the following hierarchy: Parent will contain Child , at the same timeChild will containGrandChild. If we run the following flow and go to the Datadog APM, the result is this trace: And here the spans created: As you can see, Child and GrandChild are nested to the Parent. Nesting can have n level. The Create Span element sets a Span with a name, this span will run as soon as is created in the flow, can have a parent and fields for tags. ```yaml ``` Distributed tracing Context Injection None: No injection information. Edit Inline: Define properties for trace information. ```yaml Trace ID: (Required) to specify the trace ID of the propagated trace to correlate the trace to be created Parent ID: (Required) to specify what ID is our parent, we need the parent ID to successfully create the context of the trace to create. Sampling Priority: Used for sampling rules by priority contains a numeric value Baggage Items: The Baggage items are the tags propagated from other traces to your trace to create. This is a Map of string, string, representing the key and value to get the baggage items. A common example of a propagated tag could be orderId or customerId. ``` Note: Ensure baggage item values are not null. Use DataWeave expressions with “#[]” for transformations. Context Propagation The context propagation section is where you will set the tags you want to distribute. All the tags defined here will be shown in Datadog platforms as normal tags but also will get in the Create Operation response with the next format “ot-baggage-TAG-NAME”, and you can use it to propagate to your other apps. When you set baggage items you can define it as next. The baggage items in context propagations is a Map of string, string, representing the key and value. A common example of a propagated tag could be the correlationId or customerId. Note : If you set a property to define a baggage item you need to ensure that the value is not null. DataWeave expressions are not set by default, you need to define the “#[]” before using a DataWeave transformation. Parameters Name | Type | Description | Default Value | Required ---|---|---|---|--- config-ref | Configuration | Global configuration element of the operation | | x spanName | String | Name of the span to be created | | x parent | String | Name of a span that will act as the parent of the one created in this operation | | method | String | HTTP Method to be inserted in the span | | path | String | Path to be inserted in the span | | tags | Map | Key-value pair of tags that can be inserted in the span | | autofinish | Checkbox | Indicates if span will be auto finish at the end of the flow | false | Trace ID | String | Trace ID for context propagation | | x Parent ID | String | Parent ID for the next trace | | x Sampling priority | Int | Used for sampling rules and rates | | Baggage items | Map | Tags distributed through all spans | | Baggage items | Map | Tags distributed through all spans for context propagation | | Output “Create Span” Operation now returns a HashMap Object In APM Connector versions < 3.0.0 the Create operation returns a void element, but this changed with this update. Now we return a HashMap object of a key, value pair representing the span context of the created object. The objective of this have the ability to distribute the span to different applications. This means we will be able to propagate our trace updates in our apps. When you use the Create operation you will get the next parameters. They are the same fields that you get with the create operation: - x-datadog-trace-id : this field has the trace id. You will use this trace ID to propagate the context to other apps and correlate the next trace to be created - x-datadog-parent-id : You can use this field to specify the parent of the next traces. - x-datadog-sampling-priority : This property is used when you are using sampling rules and rates. - ot-baggage -…: All elements starting with “ot-baggage-“ are tags that will be distributed through all our spans. Note : Since the Update operation now returns an object, the payload will be overridden. Store the result value in a target variable. See the ""Recommendations Using the APM Connector 3.0.0"" article. Finish Span The Finish Span element finishes a span already created in the flow, sending this span to the Datadog APM view with its respective timestamps, contains the global configuration and the span name to be finished. ```yaml ``` Name | Type | Description | Default Value | Required ---|---|---|---|",datadog-mulesoft-docs,"datadog,mulesoft,documentation,configuration,apm,connector",high
