question,answer,category,tags,priority
How do I configure - ot-baggage -…: All elements starting with “ot-baggage-“ are tags that will be distributed through all our spans.?,"- ot-baggage -…: All elements starting with “ot-baggage-“ are tags that will be distributed through all our spans. Note : Since the Update operation now returns an object, the payload will be overridden. Store the result value in a target variable. See the ""Recommendations Using the APM Connector 3.0.0"" article. Finish Span The Finish Span element finishes a span already created in the flow, sending this span to the Datadog APM view with its respective timestamps, contains the global configuration and the span name to be finished. ```yaml ``` Name | Type | Description | Default Value | Required ---|---|---|---|--- config-ref | Configuration | Global configuration element of te operation | | x spanName | String | Name of the span to be finished | | x error | Boolean | Check if the span is marked as error | false | statusCode | Integer | Set the status code of a span if stated | | Update Span The Update Span element updates a span already created in the flow, adding tags to add more optional information between the creation and closure of it. ```yaml ``` Name | Type | Description | Default Value | Required ---|---|---|---|--- config-ref | Configuration | Global configuration element of the operation | | x spanName | String | Name of the span to be updated | | x “Update Span” Operation now returns a HashMap Object In APM Connector versions < 3.0.0 the Update operation returns a void element, but this changed with this update. Now we return a HashMap object of a key, value pair representing the span context of the created object. The objective of this have the ability to distribute the span to different applications. This means we will be able to propagate our trace updates in our apps. When you use the Update operation you will get the next parameters. They are the same fields that you get with the create operation: Activate Span The Activate Span element sets a span as the new active one, measuring all the current performance in the flow, contains the global configuration and the span name to be activated. ```yaml ``` Name | Type | Description | Default Value | Required ---|---|---|---|--- config-ref | Configuration | Global configuration element of the operation | | x spanName | String | Name of the span to be activated | | x Finish All The Finish All element sets all the spans created to finished at once, this operation is executed based on a LIFO structure, contains the Global configuration ```yaml ``` Name | Type | Description | Default Value | Required ---|---|---|---|--- config-ref | Configuration | Global configuration element of the operation | | x Logger The Logger element creates information to be logged to the stated span in the Span Name field, sending information that can be consulted in the Datadog APM view, contains the Global configuration, the span name, a message, the logging level to be chosen, and the category. This logger operation is designed to help correlating the produced log with the parent trace Id in Datadog APM. ```yaml ``` Name | Type | Description | Default Value | Required ---|---|---|---|--- config-ref | Configuration | Global configuration element of the operation | | x spanName | String | Name of the span in which the logs will be inserted | | x message | String | Message to be inserted in the span | | x level | Enumeration, one of: - DEBUG - ERROR - INFO - TRACE - WARN | Logging level of the log | INFO | | --- | --- | category | String | Label to classify the log | |",datadog-mulesoft-docs,"datadog,mulesoft,documentation,configuration,integration,apm",high
How do I configure Datadog Mule Integration 4 APM?,"Datadog Mule Integration 4 APM Note: NOVA was formerly known as IO Connect Services. URLs in this document still reference the ioconnectservices.com domain for technical compatibility. How to install Datadog Mule Integration 4 APM • Installation Process • APM Connector Configurations • APM Connector Operations • Step by step tracing Sample Installing a Run the sample tracing applications Sections: Installing and execution Getting the APIs required Exchange configurations Preparing the run configurations Execution of the APIs Getting the APIs required Please download and import in Anypoint Studio each of the 4 APIs jars: - Experience marketing-eapi NOVA/cdn/docs/Datadog-APM-Connector/examples/datadog_apis/marketing-eapi-1.0.0.jar - Process messaging-papi: NOVA/cdn/docs/Datadog-APM-Connector/examples/datadog_apis/messaging-papi-1.0.0.jar - System contacts-sapi: NOVA/cdn/docs/Datadog-APM-Connector/examples/datadog_apis/contacts-sapi-1.0.0.jar - System twilio-sapi: NOVA/cdn/docs/Datadog-APM-Connector/examples/datadog_apis/twilio-sapi-1.0.0.jar Exchange configurations Once all the APIs have been downloaded, we need to set up some Exchange configurations. 1. Ensure you have the Datadog APM Connector publish as an asset in your company's Anypoint Platform Exchange. 2. For each one of the APIs imported, update the pom.xml file by replacing every {ORGANIZATION_ID} with your own Anypoint Platform organization ID. 3. In your local maven installation open your settings.xml file. Add your Anypoint Plataform username and password inside the """" tag. Your server ID in the settings.xml file needs to match exactly with your repository ID in the pom.xml file. You can skip this step if you already have it configured. 4. Anypoint Studio should be able to start downloading the connector from your company's Exchange into your projects. If not happening automatically, please make an update in your pom.xml file or close and reopen each project. Preparing the run configurations Once you have all 4 APIs projects imported, and configurations applied, go to Run > Run configurations... Select all projects to run them simultaneously. In the Arguments tab in the Program arguments box, put the following: ```yaml -Denv=local ``` In the VM Arguments box, put the following (and please replace dd.host and ddApiKey values with your own): ```yaml -Ddd.host={place here your host ip, sample: 127.0.0.1} -DddApiKey={place here your api key sample: abcdefg123456} -Ddomain=localhost -DddAppName1=marketing-eapi-dev -DddAppName2=messaging-papi-dev -DddAppName3=contacts-sapi-dev -DddAppName4=twilio-sapi-dev -DddService1=marketing-eapi-dev -DddService2=messaging-papi-dev -DddService3=contacts-sapi-dev -DddService4=twilio-sapi-dev ``` Execution of the APIs Once installed, use the following curl command to execute the APIs from the Marketing EAPI (please note, calls made by the example APIs shared in this page are just mocked calls). ```yaml curl --location --request POST 'http://localhost:8081/api/messages' \ --header 'Content-Type: application/json' \ --data-raw '{ ""contactId"": ""a0f901f1-9105-4c06-9ec6-82f91a963d9c"", ""body"": ""Demo 10/11 - 001"" }' ``` The Marketing EAPI should return an HTTP status code 201 as a successful response. Now that the transaction has been executed, you should be able to track the event with the correlation ID in your Datadog instance, which is shared across all systems, in the Datadog > Logs section. Take the below image as a reference of what you would be able to find in your Datadog instance.",datadog-mulesoft-docs,"datadog,mulesoft,documentation,configuration,apm,connector",high
How do I configure Datadog Mule Integration 4 APM?,"Datadog Mule Integration 4 APM Datadog Config Datadog Mule Integration 4 APM • Installation Process • APM Connector Configurations • APM Connector Operations • Step by step tracing Sample The Datadog APM Global Configuration organizes connection elements such as the host and port, also provides configuration parameters for optional config like the Service Name and the Environment. ```yaml ``` Parameters Name | Type | Description | Default Value | Required ---|---|---|---|--- host | String | Host where the Datadog Instance is running | | x port | int | Port to connect to the Datadog instance | | x service | String | Service name to reference this execution | unnamed-java-app | environment | String | label to states the environment where the execution is running | |",datadog-mulesoft-docs,"datadog,mulesoft,documentation,configuration,apm,connector",high
What is DATADOG MULE INTEGRATION - JMX [On-Prem] | Visualizing and how does it work?,"DATADOG MULE INTEGRATION - JMX [On-Prem] | Visualizing Visualizing the JMX metrics Now, let's confirm you are able to see the metrics in Datadog web page. Login into: https://app.datadoghq.com/account/login?next=%2F ·Once there, go to the left menu, select Dashboards __ and there, look for JVM Metrics or JVM - Overview dashboard. o If the JVM Metrics dashboard is selected, then go up into the dashboard, below the dashboard name, and check for the $host variable, here select your host or “* ” to show hosts gathered metrics. o If the JVM - Overview dashboard is selected, then go up into the dashboard, below the dashboard name, and check for the $scope __ variable, here select your host or “* ” to show hosts gathered metrics. o Please find below an image of what it is depicted above: ·And that’s it you can visualize your JMX metrics OOB. This link contains the list of the metrics you can obtain from JMX. References",datadog-mulesoft-docs,"datadog,mulesoft,documentation,overview,dashboard",high
How do I configure DATADOG MULE INTEGRATION - JMX [On-Prem]?,"DATADOG MULE INTEGRATION - JMX [On-Prem] The Mule Runtime Manager agent JMX service allows you to monitor specific JMX metrics and send them to external services. The JMX service collects metrics, which are then sent to publishers responsible for transmitting them to external monitoring tools [1]. Datadog offers a monitoring service with a lightweight Java plugin called JMXFetch. This plugin is invoked by the Datadog Agent, connecting to the MBean Server to collect application metrics. It subsequently sends these metrics to the Datadog Agent using the DogStatsD server, which operates within the Agent[2]. Achieving comprehensive monitoring of your Mule runtimes involves installing the Datadog Mule integration into the agent, enabling Datadog APM, and collecting JVM metrics from your Mule runtime. These metrics provide deep infrastructure insights and link your instances/servers with APM services, providing a unified view of your customer-hosted runtime planes—all within a single platform. JMX metrics at mule runtimes To open JMX metrics consumption at your mule servers for the Datadog agent, you must run your mule runtime or add the below arguments [3] to your mule instance conf folder in a file named wrapper-additional.conf: ·-M-Dcom.sun.management.jmxremote o To allow the JMX client access to the Mule Java VM. ·-M-Dcom.sun.management.jmxremote.port=portNum o To enable JVM monitoring of your instance. In the property above, portNum is the port number through which you want to enable JMX RMI connections. ·-M-Dcom.sun.management.jmxremote.local.only=true o If set to false, remote system monitoring can be configured but if you are running the Datadog agent in the same instance where your mule runtime is running this is not neccessary. ·-M-Dcom.sun.management.jmxremote.authenticate=false o Password authentication for remote monitoring is enabled by default. To disable it, set the following system property when you start the Mule runtime, moreover all traffic is kept locally and no outbound monitoring is configured. ·-M-Dcom.sun.management.jmxremote.ssl=false o To use client SSL authentication then set it true, N/A for local monitoring. ·-M-Djava.rmi.server.hostname=host o To enable JVM monitoring of your instance. In the property above, host is the local IP address of your server to enable JMX RMI connections. Note : Above properties, like the host and port, will be used later in the Datadog agent configuration. After running your Mule runtime with the above configuration, the agent can collect these metrics and report them into the Datadog platform, if your Mule runtime was running and you added the properties as a wrapper- additional.conf a restart of your instance is required, let’s configure the agent to do so. Setting up the Datadog Agent for JMX fetch Prerequisites 1. A Datadog agent running. 2. Your Mule applications must be customer hosted. 3. The Datadog agent must be able to communicate with the Mule server. Ensure that the configured host and port for the Mule runtime JMX service are reachable. Configuration/Steps ·Configure the depicted file at the following link according to your needs and specs, please follow Datadog documentation: o https://docs.datadoghq.com/integrations/java/?tab=host#configuration ·Restart the datadog agent o Linux: § https://docs.datadoghq.com/agent/guide/agent- commands/?tab=agentv6v7#restart-the- agent o Windows: § https://docs.datadoghq.com/agent/basic_agent_usage/windows/?tab=gui ·Let’s check the JMXFetch is running and gathering our instance(s): o Please follow the below document to verify that JMXFetch check is executing correctly: § https://docs.datadoghq.com/agent/troubleshooting/agent_check_status/?tab=agentv6v7 § When configured and started successfully, it should show you something similar like the below image:",datadog-mulesoft-docs,"datadog,mulesoft,documentation,configuration,apm,monitoring",high
What is DATADOG MULE INTEGRATION - Configuration | Connected Apps and how does it work?,"DATADOG MULE INTEGRATION - Configuration | Connected Apps The Connected Apps permissions The Datadog Mule Integration relies on specific permissions within the MuleSoft Anypoint Platform to collect metrics. To grant these permissions, a Connected App is used. Follow the instructions in the official MuleSoft documentation to create a Connected App. https://docs.mulesoft.com/access-management/connected-apps- overview The Connected App has to be of the type App acts on its own behalf (client credentials). The Datadog Mule Integration requires the ""View Organization"" permission to collect metrics. Here's a breakdown of the required permissions for different set of metrics: Access Management: READ APPLICATIONS API Events: This permission is solely for reading data from API Manager. Datadog Mule Integration does not modify any modifications. - API GROUP ADMINISTRATOR - VIEW APIS CONFIGURATION - VIEW POLICIES API Manager: API GROUP ADMINISTRATOR VIEW CONTRACTS VIEW POLICIES ARM Monitoring Query: READ APPLICATIONS READ SERVERS ARM Mule Agent: This API needs on premise mule server and configure in conf.yaml. ARM Rest Services READ ALERTS READ APPLICATIONS READ SERVERS CloudHub: This is only required to read data from CloudHub. Datadog Mule Integration does not modify any asset. - CLOUDHUB ORGANIZATION ADMIN - READ ALERTS Exchange Experience API: This is only required to read data from Exchange. Datadog Mule Integration does not modify any asset.__ - EXCHANGE ADMINISTRATOR INSIGHT: CLOUDHUB ORGANIZATION ADMIN Object Store: MANAGE APPLICATION DATA STORES METRICS VIEWER MANAGE STORES DATA VIEW STORE CLIENTS Object Store V2 Stats: This is only required to read data from Object Store V2 statistics.Datadog Mule Integration does not modify any asset.If these metrics are not desired, make sure you comment out this entry in the configuration file in instances . - AN ADMINISTRATOR USER - MANAGE STORES DATA - STORE METRICS VIEWER - VIEW STORE CLIENTS Runtime Fabric: MANAGE RUNTIME FABRICS READ APPLICATIONS The integration does not modify in any manner the assets in Anypoint Platform, those permissions are for read-only. Full example Below is a complete configuration example (with fake credentials and ids): ```yaml init_config: hosts: anypoint: https://anypoint.mulesoft.com object_store_v2: https://object-store-us-east-1.anypoint.mulesoft.com object_store_v2_stats: https://object-store-stats.anypoint.mulesoft.com # mule_server: oauth_provider: https://anypoint.mulesoft.com/accounts/api/v2/oauth2/token basic_auth_provider: https://anypoint.mulesoft.com/accounts/login client_id: 035715123cbc31a123456a43143213f3 client_secret: bAc2345678C34aFF1aB1A12f5A245678 env_id: a3cc1234-4a24-125b-1a45-1c1aa1a13cad org_id: ac2345aa-cc13-1367-bca1-b1234a2aa4aa customer_key: a6a6-b5568ae854e5 connection_wait_time: 2 connection_attempts_num: 3 instances: - min_collection_interval: 86400 threads: 32 api_filter: - access_management - min_collection_interval: 10 threads: 32 api_filter: - arm_monitoring_query - min_collection_interval: 10 threads: 32 api_filter: - arm_mule_agent - min_collection_interval: 10 threads: 32 api_filter: - arm_rest_services - min_collection_interval: 10 threads: 32 api_filter: - cloudhub - min_collection_interval: 60 threads: 32 api_filter: - api_manager - min_collection_interval: 60 threads: 32 api_filter: - api_events - min_collection_interval: 86400 threads: 32 api_filter: - exchange_experience - min_collection_interval: 60 threads: 32 api_filter: - insight - min_collection_interval: 86400 threads: 32 api_filter: - object_store - min_collection_interval: 86400 threads: 32 api_filter: - object_store_v2_stats ``` PREVIOUS TOPIC NEXT TOPIC",datadog-mulesoft-docs,"datadog,mulesoft,documentation,overview,monitoring,configuration",high
What is DATADOG MULE INTEGRATION - Configuration and how does it work?,"DATADOG MULE INTEGRATION - Configuration The Datadog Mule Integration is a Datadog custom integration and it is configured through a conf.yaml file located at: - Windows systems - C:\ProgramData\Datadog\conf.d\iocs_dmi.d\conf.yaml - Linux systems - /etc/datadog-agent/conf.d/iocs_dmi.d/conf.yaml The configuration in the conf.yaml is divided into two parts: - INIT_CONFIG: A common part used by all the executions - INSTANCES : A list of instances to be scheduled independently init_config This section contains the common configuration used by all the instance executions. It contains the following configurations (these should not be removed): - HOSTS :Grouping of all the hosts definitions needed by Mulesoft Anypoint Reader. Some hosts are specific to some APIs, if so, it is specified in the description: - ANYPOINT The Anypoint server host url. It is preconfigured with https://anypoint.mulesoft.com but it could be different for EU or GOV Mule Regions, see https://docs.mulesoft.com/access-management/managing-users#prerequisites OBJECT_STORE_V2 : Object Store V2 server host url. See https://docs.mulesoft.com/object- store/osv2-apis for the full list of available hosts. This host definition is used by the Object Store API. Example value: https://object-store-us-east-1.anypoint.mulesoft.com OBJECT_STORE_V2_STATS : TheObject Store V2 Stats server host url. This host definition is used by the Object Store V2 Stats API. It is preconfigured with https://object-store-stats.aypoint.mulesoft.com MULE_SERVER : This is the URL or IP address of the server where a Mule Runtime with the Mule Agent is running. The MULE_SERVER host definition is utilized by the ARM APIs. For example, the value might be http://localhost:9999. OAUTH_PROVIDER : This is the OAuth Provider URL responsible for obtaining a Bearer token used for making requests to all the APIs. By default, it is preconfigured with https://anypoint.mulesoft.com/accounts/api/v2/oauth2/token. However, please note that it might differ for EU or GOV Mule Regions. For specific configurations in these regions, refer to the documentation at link to documentation. see https://docs.mulesoft.com/access-management/managing- users#prerequisites - CLIENT_ID : The Client ID for the authentication API. This value is obtained by creating a connected app in Anypoint Platform. - CLIENT_SECRET : The Client Secret for the authentication API. This value is obtained by creating a connected app in Anypoint Platform. - ENV_ID : The Environment ID represents the specific environment (such as Development, Staging, or Production). - ORG_ID : The Organization ID for the requests that requires to specify it. - CUSTOMER_KEY : The Customer key is provided from our team once the purchase is completed. - CONNECTION_WAIT_TIME : The number of seconds that authentication method will wait until next retry. If not specified it is defaulted to 2 - CONNECTION_ATTEMPTS_NUM: The number of retry attempts that authentication method will perform. If not specified it is defaulted to 3 In the Full Example section there is an example of a configuration file with all the values configured. instances This section contains a list of instances defined following the YAML list item notation -. Each instance is scheduled independently to run a set of APIs with a specific threads number configuration. Each instance contains the following configurations: - MIN_COLLECTION_INTERVAL : The time in seconds between executions. If not specified it is defaulted to 15 seconds - THREADS :The number of allowed parallel threads running the instance - API_FILTER : If not specified, all the APIs are executed, otherwise it must contain a list of APIs to run within the instance following the YAML list item notation In the Full Example Section there is an example of a configuration file with a list of instances. The example is taken directly from the conf.yaml file distributed with the integration and contains the optimum numbers we recommend for almost any scenario for min_collection_interval and threads. The metric collection of any instance can be disabled at any time by commenting out the whole instance. This means, commenting the two attributes mentioned above. Configuration process The example file provided in datadog_checks/iocs_dmi/data/conf.yaml.example and copied to the conf.d/iocs_dmi.d/conf.yaml.example folder after the installation process contains a configuration with all the possible values already configured and they should just work for the common usage case. instances section contains a list of instances that were set to a periodicity and concurrency level according to each API provided information. Even if all these values can be changed, we recommend just go with the defaults. The main configuration parameters to pay attention are: - OBJECT_STORE_V2 : In the section, it depends on the CloudHub Region and can be found at the following link https://docs.mulesoft.com/object- store/osv2-apis - MULE_SERVER : In the hosts section, it depends on the Mule Agent configuration. Following the defaults of the Mule Agent configuration it would be http://localhost:9999 to retrieve the metrics from a Mule Runtime running on the same machine Connected Apps Authentication The credentials to get access to the Anypoint platform. More information about Connected Apps :https://docs.mulesoft.com/access- management/connected-apps-overview. The two parameters to configure: - CLIENT_ID: Connected Apps account client_id - CLIENT_SECRET: It must be configured with the Connected Apps account client_secret - ENV_ID The Environment ID for environment specific requests. See https://docs.mulesoft.com/access- management/environments and https://help.mulesoft.com/s/question/0D52T00004mXPvSSAW/how-to-find-cloud- hub-environment- id - ORG_ID: The Organization ID for the requests that requires to specify it. See https://docs.mulesoft.com/access- management/organization and https://help.mulesoft.com/s/article/How-to- know-my-Organization-ID-Org-ID-on-the-Anypoint- Platform - API_KEY: The API key provided by NOVA when you purchased the product - CUSTOMER_KEY The Customer key provided by NOVA when you purchased the product For EU or GOV Mule Regions, the anypoint and oauth_provider should be changed too. See https://docs.mulesoft.com/access-management/managing- users#prerequisites",datadog-mulesoft-docs,"datadog,mulesoft,documentation,overview,installation,configuration",high
How do I configure Datadog Mule Integration - Customization?,"Datadog Mule Integration - Customization Note: NOVA was formerly known as IO Connect Services. URLs in this document still reference the ioconnectservices.com domain for technical compatibility. The instances property in the conf.yaml file allows you to customize how the agent collects metrics. This means you can manually distribute the API requests performed by the agent, balancing the load across different instances and collecting data based on your specific requirements. Let's assume you are interested in getting updated data of your CloudHub and On-Prem apps behavior, through the Development: Optimizations dashboards, you'd like to monitor the CPU, memory and networking in a constant rate, but you won't like to push the agent to get at the same rate the metrics of your resource allocation. You can easily set up the following configuration to fulfill the depicted requirement. yaml instances: - min_collection_interval: 172800 threads: 32 api_filter: - access_management - min_collection_interval: 10 threads: 32 api_filter: - cloudhub In this example, you are running two separate executions of our metric reader program. If you find yourself in a scenario where customizing API calls is necessary, you can refer to the [NOVA/dmi/configuration) section to locate the configuration YAML file and adjust your settings accordingly. After making the changes, simply restart the agent to apply the new configuration, and you will have a customized agent ready to meet your specific needs.",datadog-mulesoft-docs,"datadog,mulesoft,documentation,configuration,dashboard,monitoring",high
